问题id,问题,实体答案,final_ans1,ans_list
17,各报告期末，江苏旷达汽车织物集团股份有限公司存货分别为多少万元？占流动资产的比例分别多少？,旷达汽车织物集团股份有限公司,"各报告期末，江苏旷达汽车织物集团股份有限公司存货分别为4,924.58万元、6,647.27万元、8,576.59万元和9,832.60万元，占流动资产的比例分别为14.15%、20.32%、17.02%和21.14%。
各报告期末，江苏旷达汽车织物集团股份有限公司的存货分别为4,924.58万元、6,647.27万元、8,576.59万元和9,832.60万元，占流动资产的比例分别为14.15%、20.32%、17.02%和21.14%。
各报告期末，江苏旷达汽车织物集团股份有限公司存货分别为10,820.70万元、12,977.66万元、16,738.71万元和18,263.37万元。占流动资产的比例分别为32.14%、34.81%、36.20%和38.48%。
根据资料，各报告期末，江苏旷达汽车织物集团股份有限公司存货分别为4,924.58万元、6,647.27万元、8,576.59万元和9,832.60万元。占各期末流动资产的比例分别为14.15%、20.32%、17.02%和21.14%。
各报告期末，江苏旷达汽车织物集团股份有限公司存货分别为 4,924.58 万元、6,647.27 万元、8,576.59 万元 和 9,832.60万元，占流动资产的比例分别为14.15%、20.32%、17.02%和21.14%。
各报告期末，江苏旷达汽车织物集团股份有限公司存货分别为 4,924.58 万元、6,647.27 万元、8,576.59 万元和9,832.60万元。占流动资产的比例分别为14.15%、20.32%、17.02%和21.14%。
根据资料，各报告期末，江苏旷达汽车织物集团股份有限公司存货分别为：2008年末存货余值为22,531.36万元，占流动资产的比重为34.98%；2009年末存货余值为30,640.39万元，占流动资产的比重为29.02%；2010年6月末存货余值为34,804.05万元，占流动资产的比重为14.64%。
各报告期末，江苏旷达汽车织物集团股份有限公司存货分别为 4,924.58 万元、6,647.27 万元、8,576.59 万元和9,832.60万元。占流动资产的比例分别为14.15%、20.32%、17.02%和21.14%。
各报告期末，江苏旷达汽车织物集团股份有限公司存货分别为 4924.58万元、8576.59万元、9832.60万元和 1387.44万元，占流动资产比例分别为 14.15%、17.02%、21.14%和 30.94%。
根据资料中的表格，“各报告期末，江苏旷达汽车织物集团股份有限公司存货”对应的值是“39.11”、“271.60”、“334.00”、“585.47”，因此答案为“39.11”、“271.60”、“334.00”、“585.47”。
","['各报告期末，江苏旷达汽车织物集团股份有限公司存货分别为4,924.58万元、6,647.27万元、8,576.59万元和9,832.60万元，占流动资产的比例分别为14.15%、20.32%、17.02%和21.14%。', '各报告期末，江苏旷达汽车织物集团股份有限公司的存货分别为4,924.58万元、6,647.27万元、8,576.59万元和9,832.60万元，占流动资产的比例分别为14.15%、20.32%、17.02%和21.14%。', '各报告期末，江苏旷达汽车织物集团股份有限公司存货分别为10,820.70万元、12,977.66万元、16,738.71万元和18,263.37万元。占流动资产的比例分别为32.14%、34.81%、36.20%和38.48%。', '根据资料，各报告期末，江苏旷达汽车织物集团股份有限公司存货分别为4,924.58万元、6,647.27万元、8,576.59万元和9,832.60万元。占各期末流动资产的比例分别为14.15%、20.32%、17.02%和21.14%。', '各报告期末，江苏旷达汽车织物集团股份有限公司存货分别为 4,924.58 万元、6,647.27 万元、8,576.59 万元 和 9,832.60万元，占流动资产的比例分别为14.15%、20.32%、17.02%和21.14%。', '各报告期末，江苏旷达汽车织物集团股份有限公司存货分别为 4,924.58 万元、6,647.27 万元、8,576.59 万元和9,832.60万元。占流动资产的比例分别为14.15%、20.32%、17.02%和21.14%。', '根据资料，各报告期末，江苏旷达汽车织物集团股份有限公司存货分别为：2008年末存货余值为22,531.36万元，占流动资产的比重为34.98%；2009年末存货余值为30,640.39万元，占流动资产的比重为29.02%；2010年6月末存货余值为34,804.05万元，占流动资产的比重为14.64%。', '各报告期末，江苏旷达汽车织物集团股份有限公司存货分别为 4,924.58 万元、6,647.27 万元、8,576.59 万元和9,832.60万元。占流动资产的比例分别为14.15%、20.32%、17.02%和21.14%。', '各报告期末，江苏旷达汽车织物集团股份有限公司存货分别为 4924.58万元、8576.59万元、9832.60万元和 1387.44万元，占流动资产比例分别为 14.15%、17.02%、21.14%和 30.94%。', '根据资料中的表格，“各报告期末，江苏旷达汽车织物集团股份有限公司存货”对应的值是“39.11”、“271.60”、“334.00”、“585.47”，因此答案为“39.11”、“271.60”、“334.00”、“585.47”。']"
18,2019年中期报告里，华夏基金管理有限公司管理的基金中，机构投资者持有份额比个人投资者多的基金有多少只?,N_A,N_A,[]
19,"假设股票日收益率计算公式为：日收益率=（当日收盘价-昨收盘价）/昨收盘价。请帮我找到在2021年，申万行业分类行业划分标准,银行一级行业中,代码为多少的股票的日均收益率最高？",N_A,N_A,[]
20,在20201022，按照中信行业分类的行业划分标准，哪个一级行业的A股公司数量最多？,N_A,N_A,[]
